
> financiero@1.0.0 test
> jest --coverage --watchAll=false

FAIL hooks/__tests__/use-color-scheme.web.test.ts
  ● useColorScheme (web) › should return light initially before hydration

    expect(received).toBe(expected) // Object.is equality

    Expected: "light"
    Received: "dark"

    [0m [90m 17 |[39m     [36mconst[39m { result } [33m=[39m renderHook(() [33m=>[39m useColorScheme())[33m;[39m
     [90m 18 |[39m
    [31m[1m>[22m[39m[90m 19 |[39m     expect(result[33m.[39mcurrent)[33m.[39mtoBe([32m'light'[39m)[33m;[39m
     [90m    |[39m                            [31m[1m^[22m[39m
     [90m 20 |[39m   })[33m;[39m
     [90m 21 |[39m
     [90m 22 |[39m   it([32m'should return actual color scheme after hydration'[39m[33m,[39m [36masync[39m () [33m=>[39m {[0m

      at Object.toBe (hooks/__tests__/use-color-scheme.web.test.ts:19:28)

PASS contexts/__tests__/splash-context.test.tsx
PASS hooks/__tests__/use-features.test.tsx
PASS hooks/__tests__/use-tenants.test.ts
PASS utils/__tests__/image-to-base64.test.ts
  ● Console

    console.error
      20:54:56 [UI] Error converting image to base64: Error: Network error
          at Object.<anonymous> (C:\Libelula\financiero\utils\__tests__\image-to-base64.test.ts:43:51)
          at Generator.next (<anonymous>)
          at asyncGeneratorStep (C:\Libelula\financiero\node_modules\@babel\runtime\helpers\asyncToGenerator.js:3:17)
          at _next (C:\Libelula\financiero\node_modules\@babel\runtime\helpers\asyncToGenerator.js:17:9)
          at C:\Libelula\financiero\node_modules\@babel\runtime\helpers\asyncToGenerator.js:22:7
          at new Promise (<anonymous>)
          at Object.<anonymous> (C:\Libelula\financiero\node_modules\@babel\runtime\helpers\asyncToGenerator.js:14:12)
          at Promise.then.completed (C:\Libelula\financiero\node_modules\jest-circus\build\utils.js:298:28)
          at new Promise (<anonymous>)
          at callAsyncCircusFn (C:\Libelula\financiero\node_modules\jest-circus\build\utils.js:231:10)
          at _callCircusTest (C:\Libelula\financiero\node_modules\jest-circus\build\run.js:316:40)
          at _runTest (C:\Libelula\financiero\node_modules\jest-circus\build\run.js:252:3)
          at _runTestsForDescribeBlock (C:\Libelula\financiero\node_modules\jest-circus\build\run.js:126:9)
          at _runTestsForDescribeBlock (C:\Libelula\financiero\node_modules\jest-circus\build\run.js:121:9)
          at run (C:\Libelula\financiero\node_modules\jest-circus\build\run.js:71:3)
          at runAndTransformResultsToJestFormat (C:\Libelula\financiero\node_modules\jest-circus\build\legacy-code-todo-rewrite\jestAdapterInit.js:122:21)
          at jestAdapter (C:\Libelula\financiero\node_modules\jest-circus\build\legacy-code-todo-rewrite\jestAdapter.js:79:19)
          at runTestInternal (C:\Libelula\financiero\node_modules\jest-runner\build\runTest.js:367:16)
          at runTest (C:\Libelula\financiero\node_modules\jest-runner\build\runTest.js:444:34)
          at Object.worker (C:\Libelula\financiero\node_modules\jest-runner\build\testWorker.js:106:12)

    [0m [90m 87 |[39m       [36mreturn[39m[33m;[39m
     [90m 88 |[39m     }
    [31m[1m>[22m[39m[90m 89 |[39m     originalError[33m.[39mcall(console[33m,[39m [33m...[39margs)[33m;[39m
     [90m    |[39m                       [31m[1m^[22m[39m
     [90m 90 |[39m   }[33m;[39m
     [90m 91 |[39m })[33m;[39m
     [90m 92 |[39m[0m

      at console.apply (jest.setup.ts:89:23)
      at Logger.apply (utils/logger.ts:57:20)
      at error (utils/image-to-base64.ts:25:9)
          at Generator.throw (<anonymous>)
      at asyncGeneratorStep (node_modules/@babel/runtime/helpers/asyncToGenerator.js:3:17)
      at _throw (node_modules/@babel/runtime/helpers/asyncToGenerator.js:20:9)

    console.error
      20:54:56 [UI] Error converting image to base64: Error: Network error
          at Object.<anonymous> (C:\Libelula\financiero\utils\__tests__\image-to-base64.test.ts:114:51)
          at Generator.next (<anonymous>)
          at asyncGeneratorStep (C:\Libelula\financiero\node_modules\@babel\runtime\helpers\asyncToGenerator.js:3:17)
          at _next (C:\Libelula\financiero\node_modules\@babel\runtime\helpers\asyncToGenerator.js:17:9)
          at C:\Libelula\financiero\node_modules\@babel\runtime\helpers\asyncToGenerator.js:22:7
          at new Promise (<anonymous>)
          at Object.<anonymous> (C:\Libelula\financiero\node_modules\@babel\runtime\helpers\asyncToGenerator.js:14:12)
          at Promise.then.completed (C:\Libelula\financiero\node_modules\jest-circus\build\utils.js:298:28)
          at new Promise (<anonymous>)
          at callAsyncCircusFn (C:\Libelula\financiero\node_modules\jest-circus\build\utils.js:231:10)
          at _callCircusTest (C:\Libelula\financiero\node_modules\jest-circus\build\run.js:316:40)
          at _runTest (C:\Libelula\financiero\node_modules\jest-circus\build\run.js:252:3)
          at _runTestsForDescribeBlock (C:\Libelula\financiero\node_modules\jest-circus\build\run.js:126:9)
          at _runTestsForDescribeBlock (C:\Libelula\financiero\node_modules\jest-circus\build\run.js:121:9)
          at run (C:\Libelula\financiero\node_modules\jest-circus\build\run.js:71:3)
          at runAndTransformResultsToJestFormat (C:\Libelula\financiero\node_modules\jest-circus\build\legacy-code-todo-rewrite\jestAdapterInit.js:122:21)
          at jestAdapter (C:\Libelula\financiero\node_modules\jest-circus\build\legacy-code-todo-rewrite\jestAdapter.js:79:19)
          at runTestInternal (C:\Libelula\financiero\node_modules\jest-runner\build\runTest.js:367:16)
          at runTest (C:\Libelula\financiero\node_modules\jest-runner\build\runTest.js:444:34)
          at Object.worker (C:\Libelula\financiero\node_modules\jest-runner\build\testWorker.js:106:12)

    [0m [90m 87 |[39m       [36mreturn[39m[33m;[39m
     [90m 88 |[39m     }
    [31m[1m>[22m[39m[90m 89 |[39m     originalError[33m.[39mcall(console[33m,[39m [33m...[39margs)[33m;[39m
     [90m    |[39m                       [31m[1m^[22m[39m
     [90m 90 |[39m   }[33m;[39m
     [90m 91 |[39m })[33m;[39m
     [90m 92 |[39m[0m

      at console.apply (jest.setup.ts:89:23)
      at Logger.apply (utils/logger.ts:57:20)
      at error (utils/image-to-base64.ts:25:9)
          at Generator.throw (<anonymous>)
      at asyncGeneratorStep (node_modules/@babel/runtime/helpers/asyncToGenerator.js:3:17)
      at _throw (node_modules/@babel/runtime/helpers/asyncToGenerator.js:20:9)

PASS utils/__tests__/receipt-html.test.ts
PASS components/__tests__/themed-text.test.tsx
PASS components/__tests__/themed-view.test.tsx
PASS contexts/__tests__/tenant-theme-context.test.tsx
PASS components/ui/__tests__/dragonfly-logo.test.tsx
PASS hooks/__tests__/use-tenants.test.tsx
  ● Console

    console.log
      20:54:56 [Theme] Loaded 3 tenants

      at Logger.apply [as info] (utils/logger.ts:45:18)

    console.error
      20:54:56 [Theme] Error loading tenants: Error: Network error
          at Object.<anonymous> (C:\Libelula\financiero\hooks\__tests__\use-tenants.test.tsx:44:38)
          at Generator.next (<anonymous>)
          at asyncGeneratorStep (C:\Libelula\financiero\node_modules\@babel\runtime\helpers\asyncToGenerator.js:3:17)
          at _next (C:\Libelula\financiero\node_modules\@babel\runtime\helpers\asyncToGenerator.js:17:9)
          at C:\Libelula\financiero\node_modules\@babel\runtime\helpers\asyncToGenerator.js:22:7
          at new Promise (<anonymous>)
          at Object.<anonymous> (C:\Libelula\financiero\node_modules\@babel\runtime\helpers\asyncToGenerator.js:14:12)
          at Promise.then.completed (C:\Libelula\financiero\node_modules\jest-circus\build\utils.js:298:28)
          at new Promise (<anonymous>)
          at callAsyncCircusFn (C:\Libelula\financiero\node_modules\jest-circus\build\utils.js:231:10)
          at _callCircusTest (C:\Libelula\financiero\node_modules\jest-circus\build\run.js:316:40)
          at _runTest (C:\Libelula\financiero\node_modules\jest-circus\build\run.js:252:3)
          at _runTestsForDescribeBlock (C:\Libelula\financiero\node_modules\jest-circus\build\run.js:126:9)
          at _runTestsForDescribeBlock (C:\Libelula\financiero\node_modules\jest-circus\build\run.js:121:9)
          at run (C:\Libelula\financiero\node_modules\jest-circus\build\run.js:71:3)
          at runAndTransformResultsToJestFormat (C:\Libelula\financiero\node_modules\jest-circus\build\legacy-code-todo-rewrite\jestAdapterInit.js:122:21)
          at jestAdapter (C:\Libelula\financiero\node_modules\jest-circus\build\legacy-code-todo-rewrite\jestAdapter.js:79:19)
          at runTestInternal (C:\Libelula\financiero\node_modules\jest-runner\build\runTest.js:367:16)
          at runTest (C:\Libelula\financiero\node_modules\jest-runner\build\runTest.js:444:34)
          at Object.worker (C:\Libelula\financiero\node_modules\jest-runner\build\testWorker.js:106:12)

    [0m [90m 87 |[39m       [36mreturn[39m[33m;[39m
     [90m 88 |[39m     }
    [31m[1m>[22m[39m[90m 89 |[39m     originalError[33m.[39mcall(console[33m,[39m [33m...[39margs)[33m;[39m
     [90m    |[39m                       [31m[1m^[22m[39m
     [90m 90 |[39m   }[33m;[39m
     [90m 91 |[39m })[33m;[39m
     [90m 92 |[39m[0m

      at console.apply (jest.setup.ts:89:23)
      at Logger.apply (utils/logger.ts:57:20)
      at error (hooks/use-tenants.ts:45:11)
          at Generator.throw (<anonymous>)
      at asyncGeneratorStep (node_modules/@babel/runtime/helpers/asyncToGenerator.js:3:17)
      at _throw (node_modules/@babel/runtime/helpers/asyncToGenerator.js:20:9)

    console.log
      20:54:56 [Theme] Loaded 3 tenants

      at Logger.apply [as info] (utils/logger.ts:45:18)

    console.log
      20:54:56 [Theme] Loaded 4 tenants

      at Logger.apply [as info] (utils/logger.ts:45:18)

    console.log
      20:54:56 [Theme] Loaded 3 tenants

      at Logger.apply [as info] (utils/logger.ts:45:18)

    console.log
      20:54:56 [Theme] Loaded 3 tenants

      at Logger.apply [as info] (utils/logger.ts:45:18)

    console.log
      20:54:56 [Theme] Loaded 3 tenants

      at Logger.apply [as info] (utils/logger.ts:45:18)

    console.log
      20:54:56 [Theme] Loaded 3 tenants

      at Logger.apply [as info] (utils/logger.ts:45:18)

PASS components/ui/__tests__/chip-icon.test.tsx
PASS components/ui/__tests__/gradient-text.test.tsx
PASS repositories/__tests__/container.test.ts
PASS hooks/__tests__/use-login-rate-limit.test.ts
PASS api/__tests__/http-client.test.ts
PASS hooks/__tests__/use-auth-flow.test.ts
PASS hooks/__tests__/use-app-theme.test.tsx
PASS hooks/__tests__/use-auth-operations.test.ts
PASS contexts/__tests__/auth-context.test.tsx
PASS utils/__tests__/api-validation.test.ts
  ● Console

    console.error
      20:54:57 [API] Validation failed for user: [
        {
          path: 'email',
          message: 'Invalid email address',
          code: 'invalid_format'
        }
      ]

    [0m [90m 87 |[39m       [36mreturn[39m[33m;[39m
     [90m 88 |[39m     }
    [31m[1m>[22m[39m[90m 89 |[39m     originalError[33m.[39mcall(console[33m,[39m [33m...[39margs)[33m;[39m
     [90m    |[39m                       [31m[1m^[22m[39m
     [90m 90 |[39m   }[33m;[39m
     [90m 91 |[39m })[33m;[39m
     [90m 92 |[39m[0m

      at console.apply (jest.setup.ts:89:23)
      at Logger.apply (utils/logger.ts:57:20)
      at error (utils/api-validation.ts:86:9)
      at Object.<anonymous> (utils/__tests__/api-validation.test.ts:38:35)

    console.log
      20:54:57 [API] Received data for user: { id: '1', name: 'John', email: 'invalid-email' }

      at Logger.apply (utils/logger.ts:38:18)

    console.error
      20:54:57 [API] Validation failed for user: [
        {
          path: 'name',
          message: 'Invalid input: expected string, received undefined',
          code: 'invalid_type'
        },
        {
          path: 'email',
          message: 'Invalid input: expected string, received undefined',
          code: 'invalid_type'
        }
      ]

    [0m [90m 87 |[39m       [36mreturn[39m[33m;[39m
     [90m 88 |[39m     }
    [31m[1m>[22m[39m[90m 89 |[39m     originalError[33m.[39mcall(console[33m,[39m [33m...[39margs)[33m;[39m
     [90m    |[39m                       [31m[1m^[22m[39m
     [90m 90 |[39m   }[33m;[39m
     [90m 91 |[39m })[33m;[39m
     [90m 92 |[39m[0m

      at console.apply (jest.setup.ts:89:23)
      at Logger.apply (utils/logger.ts:57:20)
      at error (utils/api-validation.ts:86:9)
      at Object.<anonymous> (utils/__tests__/api-validation.test.ts:49:35)

    console.log
      20:54:57 [API] Received data for user: { id: '1' }

      at Logger.apply (utils/logger.ts:38:18)

    console.error
      20:54:57 [API] Validation failed for user: [
        {
          path: '',
          message: 'Invalid input: expected object, received null',
          code: 'invalid_type'
        }
      ]

    [0m [90m 87 |[39m       [36mreturn[39m[33m;[39m
     [90m 88 |[39m     }
    [31m[1m>[22m[39m[90m 89 |[39m     originalError[33m.[39mcall(console[33m,[39m [33m...[39margs)[33m;[39m
     [90m    |[39m                       [31m[1m^[22m[39m
     [90m 90 |[39m   }[33m;[39m
     [90m 91 |[39m })[33m;[39m
     [90m 92 |[39m[0m

      at console.apply (jest.setup.ts:89:23)
      at Logger.apply (utils/logger.ts:57:20)
      at error (utils/api-validation.ts:86:9)
      at Object.<anonymous> (utils/__tests__/api-validation.test.ts:55:35)

    console.log
      20:54:57 [API] Received data for user: null

      at Logger.apply (utils/logger.ts:38:18)

    console.error
      20:54:57 [API] Validation failed for user: [
        {
          path: 'name',
          message: 'Invalid input: expected string, received undefined',
          code: 'invalid_type'
        },
        {
          path: 'email',
          message: 'Invalid input: expected string, received undefined',
          code: 'invalid_type'
        }
      ]

    [0m [90m 87 |[39m       [36mreturn[39m[33m;[39m
     [90m 88 |[39m     }
    [31m[1m>[22m[39m[90m 89 |[39m     originalError[33m.[39mcall(console[33m,[39m [33m...[39margs)[33m;[39m
     [90m    |[39m                       [31m[1m^[22m[39m
     [90m 90 |[39m   }[33m;[39m
     [90m 91 |[39m })[33m;[39m
     [90m 92 |[39m[0m

      at console.apply (jest.setup.ts:89:23)
      at Logger.apply (utils/logger.ts:57:20)
      at error (utils/api-validation.ts:86:9)
      at Object.<anonymous> (utils/__tests__/api-validation.test.ts:86:35)

    console.log
      20:54:57 [API] Received data for user: { id: '1' }

      at Logger.apply (utils/logger.ts:38:18)

    console.error
      20:54:57 [API] Validation failed for user: [
        {
          path: 'email',
          message: 'Invalid input: expected string, received undefined',
          code: 'invalid_type'
        }
      ]

    [0m [90m 87 |[39m       [36mreturn[39m[33m;[39m
     [90m 88 |[39m     }
    [31m[1m>[22m[39m[90m 89 |[39m     originalError[33m.[39mcall(console[33m,[39m [33m...[39margs)[33m;[39m
     [90m    |[39m                       [31m[1m^[22m[39m
     [90m 90 |[39m   }[33m;[39m
     [90m 91 |[39m })[33m;[39m
     [90m 92 |[39m[0m

      at console.apply (jest.setup.ts:89:23)
      at Logger.apply (utils/logger.ts:57:20)
      at error (utils/api-validation.ts:86:9)
      at validateApiData (utils/api-validation.ts:112:18)
      at utils/__tests__/api-validation.test.ts:106:30
      at Object.<anonymous> (node_modules/expect/build/toThrowMatchers.js:74:11)
      at Object.throwingMatcher [as toThrow] (node_modules/expect/build/index.js:320:21)
      at Object.toThrow (utils/__tests__/api-validation.test.ts:106:65)

    console.log
      20:54:57 [API] Received data for user: { id: '1', name: 'John' }

      at Logger.apply (utils/logger.ts:38:18)

    console.error
      20:54:57 [API] Validation failed for user: [
        {
          path: 'name',
          message: 'Invalid input: expected string, received undefined',
          code: 'invalid_type'
        },
        {
          path: 'email',
          message: 'Invalid input: expected string, received undefined',
          code: 'invalid_type'
        }
      ]

    [0m [90m 87 |[39m       [36mreturn[39m[33m;[39m
     [90m 88 |[39m     }
    [31m[1m>[22m[39m[90m 89 |[39m     originalError[33m.[39mcall(console[33m,[39m [33m...[39margs)[33m;[39m
     [90m    |[39m                       [31m[1m^[22m[39m
     [90m 90 |[39m   }[33m;[39m
     [90m 91 |[39m })[33m;[39m
     [90m 92 |[39m[0m

      at console.apply (jest.setup.ts:89:23)
      at Logger.apply (utils/logger.ts:57:20)
      at error (utils/api-validation.ts:86:9)
      at validateApiData (utils/api-validation.ts:112:18)
      at Object.<anonymous> (utils/__tests__/api-validation.test.ts:113:19)

    console.log
      20:54:57 [API] Received data for user: { id: '1' }

      at Logger.apply (utils/logger.ts:38:18)

    console.error
      20:54:57 [API] Validation failed for user: [
        {
          path: 'name',
          message: 'Invalid input: expected string, received undefined',
          code: 'invalid_type'
        },
        {
          path: 'email',
          message: 'Invalid input: expected string, received undefined',
          code: 'invalid_type'
        }
      ]

    [0m [90m 87 |[39m       [36mreturn[39m[33m;[39m
     [90m 88 |[39m     }
    [31m[1m>[22m[39m[90m 89 |[39m     originalError[33m.[39mcall(console[33m,[39m [33m...[39margs)[33m;[39m
     [90m    |[39m                       [31m[1m^[22m[39m
     [90m 90 |[39m   }[33m;[39m
     [90m 91 |[39m })[33m;[39m
     [90m 92 |[39m[0m

      at console.apply (jest.setup.ts:89:23)
      at Logger.apply (utils/logger.ts:57:20)
      at error (utils/api-validation.ts:86:9)
      at validateApiData (utils/api-validation.ts:139:10)
      at Object.<anonymous> (utils/__tests__/api-validation.test.ts:153:43)

    console.log
      20:54:57 [API] Received data for user: { id: '1' }

      at Logger.apply (utils/logger.ts:38:18)

    console.error
      20:54:57 [API] Validation failed for user: [
        {
          path: 'name',
          message: 'Invalid input: expected string, received undefined',
          code: 'invalid_type'
        },
        {
          path: 'email',
          message: 'Invalid input: expected string, received undefined',
          code: 'invalid_type'
        }
      ]

    [0m [90m 87 |[39m       [36mreturn[39m[33m;[39m
     [90m 88 |[39m     }
    [31m[1m>[22m[39m[90m 89 |[39m     originalError[33m.[39mcall(console[33m,[39m [33m...[39margs)[33m;[39m
     [90m    |[39m                       [31m[1m^[22m[39m
     [90m 90 |[39m   }[33m;[39m
     [90m 91 |[39m })[33m;[39m
     [90m 92 |[39m[0m

      at console.apply (jest.setup.ts:89:23)
      at Logger.apply (utils/logger.ts:57:20)
      at error (utils/api-validation.ts:86:9)
      at validateApiData (utils/api-validation.ts:158:29)
      at Object.validateUser (utils/__tests__/api-validation.test.ts:174:20)

    console.log
      20:54:57 [API] Received data for user: { id: '1' }

      at Logger.apply (utils/logger.ts:38:18)

PASS hooks/__tests__/use-session-timeout.test.ts
PASS components/ui/__tests__/card-brand-icons.test.tsx
PASS hooks/cards/__tests__/use-card-operation.test.ts
PASS hooks/cards/__tests__/use-card-mutations.test.ts
PASS hooks/cards/__tests__/use-card-queries.test.ts
PASS hooks/cards/__tests__/use-card-defer.test.ts
PASS utils/formatters/__tests__/date.test.ts
PASS utils/__tests__/result.test.ts
PASS repositories/schemas/__tests__/card.schema.test.ts
PASS utils/formatters/__tests__/currency.test.ts
PASS utils/__tests__/error-sanitizer.test.ts
PASS hooks/__tests__/use-keyboard.test.ts
PASS hooks/__tests__/use-responsive-layout.test.ts
PASS utils/__tests__/auth-storage.test.ts
PASS utils/__tests__/validators.test.ts
PASS api/__tests__/ssl-pinning.test.ts
PASS hooks/__tests__/use-color-scheme.test.ts
PASS utils/__tests__/logger.test.ts
PASS constants/__tests__/card-actions.test.ts
PASS constants/__tests__/card-types.test.ts
PASS repositories/mock/__tests__/auth.repository.mock.test.ts
PASS components/__tests__/error-fallback.test.tsx
PASS repositories/mock/__tests__/card.repository.mock.test.ts (19.104 s)
--------------------------------------|---------|----------|---------|---------|---------------------------------------------------------
File                                  | % Stmts | % Branch | % Funcs | % Lines | Uncovered Line #s                                       
--------------------------------------|---------|----------|---------|---------|---------------------------------------------------------
All files                             |   39.41 |       30 |   39.16 |   39.67 |                                                         
 components                           |    2.82 |     7.47 |    5.34 |    2.91 |                                                         
  animated-splash-screen.tsx          |       0 |        0 |       0 |       0 | 34-664                                                  
  auth-screens-container.tsx          |       0 |        0 |       0 |       0 | 23-63                                                   
  biometric-access-screen.tsx         |       0 |        0 |       0 |       0 | 12-144                                                  
  biometric-enable-modal.tsx          |       0 |        0 |       0 |       0 | 18-122                                                  
  email-login-screen.tsx              |       0 |        0 |       0 |       0 | 24-249                                                  
  error-fallback.tsx                  |    92.3 |    73.33 |     100 |    92.3 | 62                                                      
  forgot-password-screen.tsx          |       0 |        0 |       0 |       0 | 41-498                                                  
  haptic-tab.tsx                      |       0 |        0 |       0 |       0 | 6-13                                                    
  institution-selector-header.tsx     |       0 |        0 |       0 |       0 | 26-165                                                  
  login-screen.tsx                    |       0 |        0 |       0 |       0 | 24-281                                                  
  onboarding-screen.tsx               |       0 |        0 |       0 |       0 | 26-251                                                  
  register-screen.tsx                 |       0 |        0 |       0 |       0 | 53-500                                                  
  themed-text.tsx                     |     100 |      100 |     100 |     100 |                                                         
  themed-view.tsx                     |     100 |      100 |     100 |     100 |                                                         
 components/cards                     |       0 |        0 |       0 |       0 |                                                         
  card-actions-grid.tsx               |       0 |        0 |       0 |       0 | 10-125                                                  
  card-carousel.tsx                   |       0 |        0 |       0 |       0 | 32-93                                                   
  card-financial-info.tsx             |       0 |        0 |       0 |       0 | 27-184                                                  
  credit-card.tsx                     |       0 |        0 |       0 |       0 | 32-164                                                  
  summary-panel.tsx                   |       0 |        0 |       0 |       0 | 21-55                                                   
 components/cards/card-financial-info |       0 |        0 |       0 |       0 |                                                         
  credit-card-stats.tsx               |       0 |        0 |       0 |       0 | 45-47                                                   
  debit-card-stats.tsx                |       0 |        0 |       0 |       0 | 38-113                                                  
  hero-section.tsx                    |       0 |        0 |       0 |       0 | 39-55                                                   
  metrics.ts                          |       0 |        0 |       0 |       0 | 30-62                                                   
  styles.ts                           |       0 |        0 |       0 |       0 | 5                                                       
  utils.ts                            |       0 |        0 |       0 |       0 | 13-15                                                   
  virtual-card-stats.tsx              |       0 |        0 |       0 |       0 | 37-53                                                   
 components/cards/insurance           |       0 |        0 |       0 |       0 |                                                         
  insurance-card-components.tsx       |       0 |        0 |       0 |       0 | 16-103                                                  
  insurance-card-constants.ts         |       0 |        0 |       0 |       0 | 4-47                                                    
  insurance-card-styles.ts            |       0 |        0 |       0 |       0 | 5                                                       
  insurance-card.tsx                  |       0 |        0 |       0 |       0 | 18-62                                                   
  insurance-carousel.tsx              |       0 |        0 |       0 |       0 | 17-155                                                  
  insurance-detail-modal-styles.ts    |       0 |        0 |       0 |       0 | 12-249                                                  
  insurance-detail-modal.tsx          |       0 |        0 |       0 |       0 | 22-84                                                   
  insurance-generator.ts              |       0 |        0 |       0 |       0 | 34-298                                                  
  insurance-result-modal.tsx          |       0 |        0 |       0 |       0 | 23-57                                                   
  modal-content.tsx                   |       0 |      100 |       0 |       0 | 15-36                                                   
  modal-footer.tsx                    |       0 |        0 |       0 |       0 | 19-63                                                   
  modal-header.tsx                    |       0 |        0 |       0 |       0 | 17-18                                                   
 components/cards/operations          |       0 |        0 |       0 |       0 |                                                         
  advance-components.tsx              |       0 |        0 |       0 |       0 | 14-103                                                  
  biometric-guard.tsx                 |       0 |        0 |       0 |       0 | 9-97                                                    
  card-operation-header.tsx           |       0 |        0 |       0 |       0 | 25-71                                                   
  defer-components.tsx                |       0 |        0 |       0 |       0 | 16-90                                                   
  operation-result-screen.tsx         |       0 |        0 |       0 |       0 | 27-139                                                  
  pay-components.tsx                  |       0 |        0 |       0 |       0 | 14-55                                                   
  receipt-view.tsx                    |       0 |        0 |       0 |       0 | 19-123                                                  
  statements-components.tsx           |       0 |        0 |       0 |       0 | 25-111                                                  
 components/navigation                |       0 |        0 |       0 |       0 |                                                         
  navigation-button.tsx               |       0 |        0 |       0 |       0 | 13-43                                                   
 components/tenant                    |       0 |        0 |       0 |       0 |                                                         
  tenant-selector-components.tsx      |       0 |        0 |       0 |       0 | 17-148                                                  
 components/ui                        |    1.99 |     5.55 |    4.21 |    2.08 |                                                         
  add-to-wallet-button.tsx            |       0 |        0 |       0 |       0 | 11-118                                                  
  animated-number.tsx                 |       0 |        0 |       0 |       0 | 11-62                                                   
  auth-logo-header.tsx                |       0 |        0 |       0 |       0 | 26-89                                                   
  card-background-patterns.tsx        |       0 |        0 |       0 |       0 | 13-263                                                  
  card-brand-icons.tsx                |     100 |      100 |     100 |     100 |                                                         
  chip-icon.tsx                       |     100 |      100 |     100 |     100 |                                                         
  circular-progress.tsx               |       0 |        0 |       0 |       0 | 11-96                                                   
  dragonfly-loading.tsx               |       0 |        0 |       0 |       0 | 15-106                                                  
  dragonfly-logo.tsx                  |     100 |      100 |     100 |     100 |                                                         
  faq-button.tsx                      |       0 |        0 |       0 |       0 | 12-45                                                   
  financial-icons.tsx                 |       0 |        0 |       0 |       0 | 11-364                                                  
  gradient-text.tsx                   |     100 |      100 |     100 |     100 |                                                         
  info-icon.tsx                       |       0 |        0 |       0 |       0 | 15-23                                                   
  info-tooltip.tsx                    |       0 |        0 |       0 |       0 | 26-806                                                  
  loading-screen.tsx                  |       0 |        0 |       0 |       0 | 13-38                                                   
  option-card.tsx                     |       0 |        0 |       0 |       0 | 28-78                                                   
  powered-by.tsx                      |       0 |      100 |       0 |       0 | 11-28                                                   
  tab-icons.tsx                       |       0 |        0 |       0 |       0 | 21-70                                                   
  themed-button.tsx                   |       0 |        0 |       0 |       0 | 27-95                                                   
  themed-input.tsx                    |       0 |        0 |       0 |       0 | 22-52                                                   
 contexts                             |   59.51 |    68.91 |   46.34 |      61 |                                                         
  auth-context.tsx                    |     100 |      100 |     100 |     100 |                                                         
  splash-context.tsx                  |     100 |      100 |     100 |     100 |                                                         
  tenant-theme-context.tsx            |     100 |       95 |     100 |     100 | 25                                                      
  tour-context.tsx                    |       0 |        0 |       0 |       0 | 6-161                                                   
 hooks                                |   92.89 |    88.51 |    90.8 |   94.47 |                                                         
  use-app-theme.ts                    |     100 |       40 |     100 |     100 | 59-65                                                   
  use-auth-flow.ts                    |     100 |      100 |     100 |     100 |                                                         
  use-auth-operations.ts              |     100 |      100 |     100 |     100 |                                                         
  use-color-scheme.ts                 |       0 |        0 |       0 |       0 |                                                         
  use-color-scheme.web.ts             |     100 |      100 |     100 |     100 |                                                         
  use-features.ts                     |     100 |      100 |     100 |     100 |                                                         
  use-keyboard.ts                     |     100 |      100 |     100 |     100 |                                                         
  use-login-rate-limit.ts             |     100 |      100 |     100 |     100 |                                                         
  use-responsive-layout.ts            |     100 |      100 |     100 |     100 |                                                         
  use-session-timeout.ts              |   98.52 |    93.54 |     100 |     100 | 67,119                                                  
  use-statement-export.ts             |       0 |        0 |       0 |       0 | 25-77                                                   
  use-tenants.ts                      |   96.15 |    66.66 |     100 |     100 | 42-57                                                   
 hooks/cards                          |   62.01 |    44.44 |   68.67 |    59.8 |                                                         
  use-card-defer.ts                   |     100 |      100 |     100 |     100 |                                                         
  use-card-mutations.ts               |   52.27 |     6.25 |   68.42 |      50 | 77-80,95-98,110-113,119-128,134-143,152-157,166-171     
  use-card-operation.ts               |     100 |    96.15 |     100 |     100 | 73                                                      
  use-card-queries.ts                 |   95.77 |    71.42 |     100 |   95.65 | 82-84                                                   
  use-cards-screen.ts                 |       0 |        0 |       0 |       0 | 19-232                                                  
 repositories                         |   82.75 |    56.25 |    87.5 |   81.48 |                                                         
  container.ts                        |   82.75 |    56.25 |    87.5 |   81.48 | 35-39,89-94                                             
 repositories/interfaces              |       0 |        0 |       0 |       0 |                                                         
  auth.repository.interface.ts        |       0 |        0 |       0 |       0 |                                                         
  card.repository.interface.ts        |       0 |        0 |       0 |       0 |                                                         
  tenant.repository.interface.ts      |       0 |        0 |       0 |       0 |                                                         
 repositories/mock                    |   57.59 |    33.92 |   63.63 |   57.43 |                                                         
  auth.repository.mock.ts             |    38.7 |    31.57 |   53.84 |    37.7 | 101-222                                                 
  card.repository.mock.ts             |   83.33 |    53.84 |   84.84 |   83.33 | 201,247,288-300,316-320,348-349                         
  tenant.repository.mock.ts           |   11.11 |        0 |       0 |   13.33 | 14,505-528                                              
 repositories/real                    |       0 |        0 |       0 |       0 |                                                         
  auth.repository.real.ts             |       0 |        0 |       0 |       0 | 41-184                                                  
  card.repository.real.ts             |       0 |        0 |       0 |       0 | 53-245                                                  
  tenant.repository.real.ts           |       0 |        0 |       0 |       0 | 17-47                                                   
 repositories/schemas                 |   94.02 |      100 |      20 |   94.02 |                                                         
  auth.schema.ts                      |   81.81 |      100 |       0 |   81.81 | 25-37                                                   
  card.schema.ts                      |     100 |      100 |     100 |     100 |                                                         
  tenant.schema.ts                    |     100 |      100 |     100 |     100 |                                                         
 utils                                |   90.07 |    88.29 |   93.67 |    90.2 |                                                         
  api-validation.ts                   |   88.57 |       75 |     100 |      90 | 30,36,38                                                
  auth-storage.ts                     |   79.48 |     87.5 |   86.36 |   79.48 | 120-121,132,151-156,183,196-197,208,223-224,235,252-253 
  error-sanitizer.ts                  |   94.11 |    90.16 |     100 |   94.11 | 128,143                                                 
  image-to-base64.ts                  |      95 |      100 |     100 |      95 | 43                                                      
  logger.ts                           |     100 |    63.63 |     100 |     100 | 36-56                                                   
  receipt-html.ts                     |     100 |    93.75 |     100 |     100 | 230                                                     
  result.ts                           |   95.65 |    93.87 |    91.3 |   95.65 | 152-160                                                 
  validators.ts                       |     100 |      100 |     100 |     100 |                                                         
 utils/formatters                     |   86.22 |    83.96 |     100 |   86.22 |                                                         
  currency.ts                         |   71.69 |    76.31 |     100 |   71.69 | 46-47,75-76,131,153-164,189-190                         
  date.ts                             |   92.98 |    87.09 |     100 |   92.98 | 88-89,250-251,285-286,305-306                           
--------------------------------------|---------|----------|---------|---------|---------------------------------------------------------

Summary of all failing tests
FAIL hooks/__tests__/use-color-scheme.web.test.ts
  ● useColorScheme (web) › should return light initially before hydration

    expect(received).toBe(expected) // Object.is equality

    Expected: "light"
    Received: "dark"

    [0m [90m 17 |[39m     [36mconst[39m { result } [33m=[39m renderHook(() [33m=>[39m useColorScheme())[33m;[39m
     [90m 18 |[39m
    [31m[1m>[22m[39m[90m 19 |[39m     expect(result[33m.[39mcurrent)[33m.[39mtoBe([32m'light'[39m)[33m;[39m
     [90m    |[39m                            [31m[1m^[22m[39m
     [90m 20 |[39m   })[33m;[39m
     [90m 21 |[39m
     [90m 22 |[39m   it([32m'should return actual color scheme after hydration'[39m[33m,[39m [36masync[39m () [33m=>[39m {[0m

      at Object.toBe (hooks/__tests__/use-color-scheme.web.test.ts:19:28)


Test Suites: 1 failed, 43 passed, 44 total
Tests:       1 failed, 683 passed, 684 total
Snapshots:   0 total
Time:        23.619 s
Ran all test suites.
